{
  "$schema": "https://json-schema.org/draft/2020-12/schema",
  "$id": "joist-exemplar-record-v0",
  "title": "Joist exemplar library record v0 (EMBODIMENT_APPROACH §P3)",
  "description": "One visual-pattern-keyed exemplar: (rendered appearance ↔ authored contract-HTML [↔ Elementor JSON where it exists]). Records are retrieved by retrieve.mjs as few-shot context for authoring agents — retrieval replaces fine-tuning at our scale. Store layout (all paths relative to eval/grader/exemplars/): records/<id>.json (this schema), html/<id>.html (authored snippet, self-contained renderable, assets under html/assets/), renders/<id>.png (local-chromium render, pre-transpile). NEVER admit a record whose verification rests on the old deflated/inflated deterministic graders.",
  "type": "object",
  "required": ["id", "constructIds", "visualDescriptor", "renderPng", "authoredHtml", "elementorJson", "provenance", "verification", "hash"],
  "additionalProperties": false,
  "properties": {
    "id": { "type": "string", "pattern": "^[a-z0-9][a-z0-9-]*$", "description": "Unique record id; also the basename of html/ + renders/ files." },
    "constructIds": {
      "type": "array", "minItems": 1, "uniqueItems": true,
      "items": { "enum": ["body-text", "heading", "button-cta", "image", "icon-svg", "logo", "stat-number", "badge-pill", "nav-links", "inline-styled-text", "code-panel", "video-embed", "divider", "form", "section-stack", "nav-row", "sticky-chrome", "hero-stack", "card", "card-grid", "split-2col", "logo-band", "footer-columns", "cta-band", "bg-image-section", "absolute-overlay", "marquee", "accordion", "tabs", "modal", "scroll-reveal"] },
      "description": "Atlas construct vocabulary (eval/grader/atlas/atlas.json v0.1.0) present in this exemplar. Primary retrieval key."
    },
    "visualDescriptor": {
      "type": "object",
      "required": ["structuralSignature", "palette", "densityTags"],
      "additionalProperties": false,
      "description": "Compact visual key. palette + densityTags are computed DETERMINISTICALLY from the render PNG by lib.mjs describePng() — the same function retrieve.mjs runs on the query crop, so keys and queries live in one space.",
      "properties": {
        "structuralSignature": { "enum": ["flex-row", "flex-col", "grid-2col", "grid-3col", "grid-4pluscol", "absolute-overlay", "inline-flow", "sticky-fixed-chrome", "split-2col", "block-stack"], "description": "§4.1 pre-registered enum; assigned by the record author from the section's top-level layout." },
        "palette": { "type": "array", "minItems": 1, "maxItems": 3, "items": { "type": "string", "pattern": "^#[0-9a-f]{6}$" }, "description": "Top-3 quantized dominant colors of the render, most frequent first (lib.mjs)." },
        "densityTags": { "type": "array", "items": { "enum": ["dark-bg", "light-bg", "mid-bg", "sparse", "medium", "dense", "muted", "colorful", "wide-band", "banner", "tall"] }, "description": "Closed tag set computed from the render PNG (lib.mjs): bg luma class, ink-coverage class, chroma class, aspect class." }
      }
    },
    "renderPng": { "type": "string", "description": "Store-relative path to the local-chromium render of authoredHtml (renders/<id>.png). WP-free, pre-transpile." },
    "renderSize": { "type": "object", "properties": { "w": { "type": "integer" }, "h": { "type": "integer" } }, "description": "Render dimensions (informational)." },
    "authoredHtml": { "type": "string", "description": "Store-relative path to the authored snippet (html/<id>.html). Self-contained single-file contract HTML (knowledge/AUTHORING_CONTRACT.md): one head <style>, body = the section." },
    "elementorJson": { "type": ["string", "null"], "description": "Store-relative path to the verified Elementor JSON fragment for this section. NULL until the WP sandbox phase (P4+) produces save-surviving trees; never fake it." },
    "provenance": { "enum": ["spike", "re-author", "verified-clone", "synthetic"], "description": "spike = section of the proven HTML-first clerk spike; re-author = re-authored from capture artifacts (incl. the P2 contract re-author and the local-fidelity partial); verified-clone = judge-passed section from a real clone run; synthetic = authored from scratch for construct coverage." },
    "verification": {
      "type": "object",
      "required": ["status", "evidence"],
      "additionalProperties": false,
      "properties": {
        "status": { "enum": ["judged", "pixel-parity", "look-only", "lint-clean-rendered"], "description": "judged = vision-judge tile evidence vs the real source; pixel-parity = pixel-diff-proven against a judged artifact; look-only = human/agent LOOK at render vs source crop, no judge run; lint-clean-rendered = synthetic (no source ground truth — lint-clean + renders sanely, NO fidelity claim)." },
        "evidence": { "type": "array", "minItems": 1, "items": { "type": "string" }, "description": "Paths/refs backing the status (judge results.json, lint reports, pixel-diff numbers, source crops). /tmp paths are volatile — flagged inline." },
        "notes": { "type": "string" }
      }
    },
    "lint": {
      "type": "object",
      "required": ["clean"],
      "properties": { "clean": { "type": "boolean" }, "violations": { "type": "array" }, "warnings": { "type": "array" } },
      "description": "lint-authoring.mjs verdict on authoredHtml at record-build time. Non-clean records are admitted ONLY for proven provenance (e.g. the spike's V-NEST section) and must list violations here."
    },
    "source": { "type": "object", "properties": { "site": { "type": "string" }, "crop": { "type": "string" }, "width": { "type": "integer" } }, "description": "What this exemplar depicts (site, source-crop path if any, authoring viewport width)." },
    "hash": { "type": "string", "pattern": "^sha256:[0-9a-f]{64}$", "description": "sha256 of the authored HTML bytes — integrity + dedupe key." }
  }
}
